{
    "name": "Messages list",
    "description": "Listing of pending messages.",
    "header": {
        "actions": {
            "ACTION.CREATE": false
        },
        "selection": {
            "default" : false,
            "actions" : [
                {
                    "id": "header.selection.actions.bulk_dismiss",
                    "label": "Retry",
                    "icon": "replay",
                    "controller": "core_alert_bulk-dismiss"
                }
            ]
        }
    },
    "layout": {
        "items": [
            {
                "type": "field",
                "value": "label",
                "width": "25%"
            },
            {
                "type": "field",
                "value": "object_link",
                "width": "25%"
            },
            {
                "type": "field",
                "value": "description",
                "label": "Name",
                "width": "35%"
            },
            {
                "type": "field",
                "value": "severity",
                "width": "15%"
            }
        ]
    }
}