{
    "name": "Emails",
    "description": "List of outgoing emails.",
    "order": "created",
    "sort": "desc",
    "layout": {
        "items": [
            {
                "type": "field",
                "value": "name",
                "width": "30%",
                "widget": {
                    "sortable": true,
                    "wrap": true
                }
            },
            {
                "type": "field",
                "value": "creator",
                "width": "20%"
            },
            {
                "type": "field",
                "value": "created",
                "width": "15%",
                "widget": {
                    "usage": "datetime/short",
                    "sortable": true
                }
            },
            {
                "type": "field",
                "label": "Sent",
                "value": "modified",
                "width": "15%",
                "widget": {
                    "usage": "datetime/short",
                    "sortable": true
                }
            },
            {
                "type": "field",
                "value": "reply_to",
                "width": "25%"
            },
            {
                "type": "field",
                "value": "to",
                "width": "25%"
            },
            {
                "type": "field",
                "value": "cc",
                "width": "25%"
            },
            {
                "type": "field",
                "value": "status",
                "width": "10%",
                "widget": {
                    "sortable": true
                }
            },
            {
                "type": "field",
                "value": "response_status",
                "width": "10%"
            }
        ]
    }
}