{
    "name": "Groups list",
    "description": "This view is intended for displaying basic listing of existing groups",
    "order": "name",
    "sort": "asc",
    "header": {
        "actions": {
            "ACTION.CREATE": [
                {
                    "visible": ["user.groups", "contains", "admins"]
                }
            ],
            "ACTION.SELECT": [
                {
                    "visible": ["user.groups", "contains", "admins"]
                }
            ]
        }
    },
    "layout": {
        "items": [
            {
                "type": "field",
                "value": "name",
                "width": "25%",
                "widget": {
                    "sortable": true
                }
            },
            {
                "type": "field",
                "value": "display_name",
                "width": "35%"
            },
            {
                "type": "field",
                "value": "description",
                "width": "35%"
            }
        ]
    }
}