{
    "name": "Permissions list",
    "description": "This view is intended for displaying basic listing of existing permissions",
    "order": "name",
    "sort": "asc",
    "layout": {
        "items": [
            {
                "type": "field",
                "value": "class_name",
                "width": "15%",
                "widget": {
                    "sortable": true
                }
            },
            {
                "type": "field",
                "value": "group_id",
                "label": "Group",
                "width": "20%"
            },
            {
                "type": "field",
                "value": "user_id",
                "label": "User",
                "width": "20%"
            },
            {
                "type": "field",
                "value": "rights_txt",
                "label": "Rights",
                "width": "30%"
            }
        ]
    }
}